{
  "schema_version": 1,
  "target": "microsoft-sentinel",
  "api_version": "2025-09-01",
  "source_profile": "targets/sentinel/preview.json",
  "rules": [
    {
      "id": "MSEC-DET-0002",
      "enabled": false,
      "query_frequency": "PT15M",
      "query_period": "PT1H",
      "trigger_operator": "GreaterThan",
      "trigger_threshold": 0,
      "suppression_duration": "PT1H",
      "suppression_enabled": false,
      "event_grouping": "AlertPerResult",
      "create_incident": false,
      "incident_lookback": "PT5H"
    },
    {
      "id": "MSEC-DET-0003",
      "enabled": false,
      "query_frequency": "PT15M",
      "query_period": "PT1H",
      "trigger_operator": "GreaterThan",
      "trigger_threshold": 0,
      "suppression_duration": "PT1H",
      "suppression_enabled": false,
      "event_grouping": "AlertPerResult",
      "create_incident": false,
      "incident_lookback": "PT5H"
    },
    {
      "id": "MSEC-DET-0004",
      "enabled": false,
      "query_frequency": "PT15M",
      "query_period": "PT1H",
      "trigger_operator": "GreaterThan",
      "trigger_threshold": 0,
      "suppression_duration": "PT1H",
      "suppression_enabled": false,
      "event_grouping": "AlertPerResult",
      "create_incident": false,
      "incident_lookback": "PT5H"
    },
    {
      "id": "MSEC-DET-0005",
      "enabled": false,
      "query_frequency": "PT15M",
      "query_period": "PT1H",
      "trigger_operator": "GreaterThan",
      "trigger_threshold": 0,
      "suppression_duration": "PT1H",
      "suppression_enabled": false,
      "event_grouping": "AlertPerResult",
      "create_incident": false,
      "incident_lookback": "PT5H"
    },
    {
      "id": "MSEC-DET-0006",
      "enabled": false,
      "query_frequency": "PT15M",
      "query_period": "PT1H",
      "trigger_operator": "GreaterThan",
      "trigger_threshold": 0,
      "suppression_duration": "PT1H",
      "suppression_enabled": false,
      "event_grouping": "AlertPerResult",
      "create_incident": false,
      "incident_lookback": "PT5H"
    },
    {
      "id": "MSEC-DET-0007",
      "enabled": false,
      "query_frequency": "PT15M",
      "query_period": "PT1H",
      "trigger_operator": "GreaterThan",
      "trigger_threshold": 0,
      "suppression_duration": "PT1H",
      "suppression_enabled": false,
      "event_grouping": "AlertPerResult",
      "create_incident": false,
      "incident_lookback": "PT5H"
    },
    {
      "id": "MSEC-DET-0008",
      "enabled": false,
      "query_frequency": "PT15M",
      "query_period": "PT1H",
      "trigger_operator": "GreaterThan",
      "trigger_threshold": 0,
      "suppression_duration": "PT1H",
      "suppression_enabled": false,
      "event_grouping": "AlertPerResult",
      "create_incident": false,
      "incident_lookback": "PT5H"
    },
    {
      "id": "MSEC-DET-0009",
      "enabled": false,
      "query_frequency": "PT15M",
      "query_period": "PT1H",
      "trigger_operator": "GreaterThan",
      "trigger_threshold": 0,
      "suppression_duration": "PT1H",
      "suppression_enabled": false,
      "event_grouping": "AlertPerResult",
      "create_incident": false,
      "incident_lookback": "PT5H"
    },
    {
      "id": "MSEC-DET-0010",
      "enabled": false,
      "query_frequency": "PT15M",
      "query_period": "PT1H",
      "trigger_operator": "GreaterThan",
      "trigger_threshold": 0,
      "suppression_duration": "PT1H",
      "suppression_enabled": false,
      "event_grouping": "AlertPerResult",
      "create_incident": false,
      "incident_lookback": "PT5H"
    },
    {
      "id": "MSEC-DET-0011",
      "enabled": false,
      "query_frequency": "PT15M",
      "query_period": "PT1H",
      "trigger_operator": "GreaterThan",
      "trigger_threshold": 0,
      "suppression_duration": "PT1H",
      "suppression_enabled": false,
      "event_grouping": "AlertPerResult",
      "create_incident": false,
      "incident_lookback": "PT5H"
    },
    {
      "id": "MSEC-DET-0012",
      "enabled": false,
      "query_frequency": "PT15M",
      "query_period": "PT1H",
      "trigger_operator": "GreaterThan",
      "trigger_threshold": 0,
      "suppression_duration": "PT1H",
      "suppression_enabled": false,
      "event_grouping": "AlertPerResult",
      "create_incident": false,
      "incident_lookback": "PT5H"
    },
    {
      "id": "MSEC-DET-0013",
      "enabled": false,
      "query_frequency": "PT15M",
      "query_period": "PT1H",
      "trigger_operator": "GreaterThan",
      "trigger_threshold": 0,
      "suppression_duration": "PT1H",
      "suppression_enabled": false,
      "event_grouping": "AlertPerResult",
      "create_incident": false,
      "incident_lookback": "PT5H"
    },
    {
      "id": "MSEC-DET-0014",
      "enabled": false,
      "query_frequency": "PT15M",
      "query_period": "PT1H",
      "trigger_operator": "GreaterThan",
      "trigger_threshold": 0,
      "suppression_duration": "PT1H",
      "suppression_enabled": false,
      "event_grouping": "AlertPerResult",
      "create_incident": false,
      "incident_lookback": "PT5H"
    },
    {
      "id": "MSEC-DET-0015",
      "enabled": false,
      "query_frequency": "PT15M",
      "query_period": "PT1H",
      "trigger_operator": "GreaterThan",
      "trigger_threshold": 0,
      "suppression_duration": "PT1H",
      "suppression_enabled": false,
      "event_grouping": "AlertPerResult",
      "create_incident": false,
      "incident_lookback": "PT5H"
    },
    {
      "id": "MSEC-DET-0016",
      "enabled": false,
      "query_frequency": "PT15M",
      "query_period": "PT1H",
      "trigger_operator": "GreaterThan",
      "trigger_threshold": 0,
      "suppression_duration": "PT1H",
      "suppression_enabled": false,
      "event_grouping": "AlertPerResult",
      "create_incident": false,
      "incident_lookback": "PT5H"
    },
    {
      "id": "MSEC-DET-0017",
      "enabled": false,
      "query_frequency": "PT15M",
      "query_period": "PT1H",
      "trigger_operator": "GreaterThan",
      "trigger_threshold": 0,
      "suppression_duration": "PT1H",
      "suppression_enabled": false,
      "event_grouping": "AlertPerResult",
      "create_incident": false,
      "incident_lookback": "PT5H"
    },
    {
      "id": "MSEC-DET-0018",
      "enabled": false,
      "query_frequency": "PT15M",
      "query_period": "PT1H",
      "trigger_operator": "GreaterThan",
      "trigger_threshold": 0,
      "suppression_duration": "PT1H",
      "suppression_enabled": false,
      "event_grouping": "AlertPerResult",
      "create_incident": false,
      "incident_lookback": "PT5H"
    },
    {
      "id": "MSEC-DET-0019",
      "enabled": false,
      "query_frequency": "PT15M",
      "query_period": "PT1H",
      "trigger_operator": "GreaterThan",
      "trigger_threshold": 0,
      "suppression_duration": "PT1H",
      "suppression_enabled": false,
      "event_grouping": "AlertPerResult",
      "create_incident": false,
      "incident_lookback": "PT5H"
    },
    {
      "id": "MSEC-DET-0020",
      "enabled": false,
      "query_frequency": "PT15M",
      "query_period": "PT1H",
      "trigger_operator": "GreaterThan",
      "trigger_threshold": 0,
      "suppression_duration": "PT1H",
      "suppression_enabled": false,
      "event_grouping": "AlertPerResult",
      "create_incident": false,
      "incident_lookback": "PT5H"
    },
    {
      "id": "MSEC-DET-0021",
      "enabled": false,
      "query_frequency": "PT15M",
      "query_period": "PT1H",
      "trigger_operator": "GreaterThan",
      "trigger_threshold": 0,
      "suppression_duration": "PT1H",
      "suppression_enabled": false,
      "event_grouping": "AlertPerResult",
      "create_incident": false,
      "incident_lookback": "PT5H"
    },
    {
      "id": "MSEC-DET-0022",
      "enabled": false,
      "query_frequency": "PT15M",
      "query_period": "PT1H",
      "trigger_operator": "GreaterThan",
      "trigger_threshold": 0,
      "suppression_duration": "PT1H",
      "suppression_enabled": false,
      "event_grouping": "AlertPerResult",
      "create_incident": false,
      "incident_lookback": "PT5H"
    },
    {
      "id": "MSEC-DET-0023",
      "enabled": false,
      "query_frequency": "PT15M",
      "query_period": "PT1H",
      "trigger_operator": "GreaterThan",
      "trigger_threshold": 0,
      "suppression_duration": "PT1H",
      "suppression_enabled": false,
      "event_grouping": "AlertPerResult",
      "create_incident": false,
      "incident_lookback": "PT5H"
    },
    {
      "id": "MSEC-DET-0024",
      "enabled": false,
      "query_frequency": "PT15M",
      "query_period": "PT1H",
      "trigger_operator": "GreaterThan",
      "trigger_threshold": 0,
      "suppression_duration": "PT1H",
      "suppression_enabled": false,
      "event_grouping": "AlertPerResult",
      "create_incident": false,
      "incident_lookback": "PT5H"
    },
    {
      "id": "MSEC-DET-0025",
      "enabled": false,
      "query_frequency": "PT15M",
      "query_period": "PT1H",
      "trigger_operator": "GreaterThan",
      "trigger_threshold": 0,
      "suppression_duration": "PT1H",
      "suppression_enabled": false,
      "event_grouping": "AlertPerResult",
      "create_incident": false,
      "incident_lookback": "PT5H"
    },
    {
      "id": "MSEC-DET-0026",
      "enabled": false,
      "query_frequency": "PT15M",
      "query_period": "PT1H",
      "trigger_operator": "GreaterThan",
      "trigger_threshold": 0,
      "suppression_duration": "PT1H",
      "suppression_enabled": false,
      "event_grouping": "AlertPerResult",
      "create_incident": false,
      "incident_lookback": "PT5H"
    },
    {
      "id": "MSEC-DET-0027",
      "enabled": false,
      "query_frequency": "PT15M",
      "query_period": "PT1H",
      "trigger_operator": "GreaterThan",
      "trigger_threshold": 0,
      "suppression_duration": "PT1H",
      "suppression_enabled": false,